{
  "fixtureId": "PC-01-FX-UNKNOWN-PRESERVED",
  "capabilityId": "PC-01",
  "packId": "pc-01",
  "packVersion": "1.0.0",
  "kind": "ARCHITECTURE_RUNTIME",
  "knowledgeVersionId": "fixture-kv-pc-01-1.0.0",
  "description": "UNKNOWN explícito por cada canal de adquisición admitido: se preserva como UNKNOWN y nunca produce hallazgo.",
  "observations": [
    {
      "id": "obs-unknown-1",
      "variableRef": "VA01",
      "acquisitionRef": "ACQ·NI01",
      "knowledgeState": "UNKNOWN",
      "semanticValue": null,
      "sourceResponseId": "resp-unknown-1",
      "respondentId": "respondent-1",
      "evidenceIds": [],
      "recordedAt": "2026-01-01T00:00:00.000Z"
    },
    {
      "id": "obs-unknown-2",
      "variableRef": "VA02",
      "acquisitionRef": "ACQ·NI02",
      "knowledgeState": "UNKNOWN",
      "semanticValue": null,
      "sourceResponseId": "resp-unknown-2",
      "respondentId": "respondent-1",
      "evidenceIds": [],
      "recordedAt": "2026-01-01T00:00:00.000Z"
    },
    {
      "id": "obs-unknown-3",
      "variableRef": "VA03",
      "acquisitionRef": "ACQ·NI03",
      "knowledgeState": "UNKNOWN",
      "semanticValue": null,
      "sourceResponseId": "resp-unknown-3",
      "respondentId": "respondent-1",
      "evidenceIds": [],
      "recordedAt": "2026-01-01T00:00:00.000Z"
    },
    {
      "id": "obs-unknown-4",
      "variableRef": "VA04",
      "acquisitionRef": "ACQ·NI04",
      "knowledgeState": "UNKNOWN",
      "semanticValue": null,
      "sourceResponseId": "resp-unknown-4",
      "respondentId": "respondent-1",
      "evidenceIds": [],
      "recordedAt": "2026-01-01T00:00:00.000Z"
    },
    {
      "id": "obs-unknown-5",
      "variableRef": "VA05",
      "acquisitionRef": "ACQ·NI05",
      "knowledgeState": "UNKNOWN",
      "semanticValue": null,
      "sourceResponseId": "resp-unknown-5",
      "respondentId": "respondent-1",
      "evidenceIds": [],
      "recordedAt": "2026-01-01T00:00:00.000Z"
    },
    {
      "id": "obs-unknown-6",
      "variableRef": "VA06",
      "acquisitionRef": "ACQ·NI06",
      "knowledgeState": "UNKNOWN",
      "semanticValue": null,
      "sourceResponseId": "resp-unknown-6",
      "respondentId": "respondent-1",
      "evidenceIds": [],
      "recordedAt": "2026-01-01T00:00:00.000Z"
    },
    {
      "id": "obs-unknown-7",
      "variableRef": "VA07",
      "acquisitionRef": "ACQ·NI07",
      "knowledgeState": "UNKNOWN",
      "semanticValue": null,
      "sourceResponseId": "resp-unknown-7",
      "respondentId": "respondent-1",
      "evidenceIds": [],
      "recordedAt": "2026-01-01T00:00:00.000Z"
    },
    {
      "id": "obs-unknown-8",
      "variableRef": "VA08",
      "acquisitionRef": "ACQ·NI08",
      "knowledgeState": "UNKNOWN",
      "semanticValue": null,
      "sourceResponseId": "resp-unknown-8",
      "respondentId": "respondent-1",
      "evidenceIds": [],
      "recordedAt": "2026-01-01T00:00:00.000Z"
    },
    {
      "id": "obs-unknown-9",
      "variableRef": "VA09",
      "acquisitionRef": "ACQ·NI09",
      "knowledgeState": "UNKNOWN",
      "semanticValue": null,
      "sourceResponseId": "resp-unknown-9",
      "respondentId": "respondent-1",
      "evidenceIds": [],
      "recordedAt": "2026-01-01T00:00:00.000Z"
    },
    {
      "id": "obs-unknown-10",
      "variableRef": "VA10",
      "acquisitionRef": "ACQ·NI10",
      "knowledgeState": "UNKNOWN",
      "semanticValue": null,
      "sourceResponseId": "resp-unknown-10",
      "respondentId": "respondent-1",
      "evidenceIds": [],
      "recordedAt": "2026-01-01T00:00:00.000Z"
    },
    {
      "id": "obs-unknown-11",
      "variableRef": "VA11",
      "acquisitionRef": "ACQ·NI11",
      "knowledgeState": "UNKNOWN",
      "semanticValue": null,
      "sourceResponseId": "resp-unknown-11",
      "respondentId": "respondent-1",
      "evidenceIds": [],
      "recordedAt": "2026-01-01T00:00:00.000Z"
    }
  ],
  "expected": {
    "outcome": "PASS",
    "variableStates": [
      {
        "variableRef": "VA01",
        "state": "UNKNOWN",
        "semanticValue": null
      },
      {
        "variableRef": "VA02",
        "state": "UNKNOWN",
        "semanticValue": null
      },
      {
        "variableRef": "VA03",
        "state": "UNKNOWN",
        "semanticValue": null
      },
      {
        "variableRef": "VA04",
        "state": "UNKNOWN",
        "semanticValue": null
      },
      {
        "variableRef": "VA05",
        "state": "UNKNOWN",
        "semanticValue": null
      },
      {
        "variableRef": "VA06",
        "state": "UNKNOWN",
        "semanticValue": null
      },
      {
        "variableRef": "VA07",
        "state": "UNKNOWN",
        "semanticValue": null
      },
      {
        "variableRef": "VA08",
        "state": "UNKNOWN",
        "semanticValue": null
      },
      {
        "variableRef": "VA09",
        "state": "UNKNOWN",
        "semanticValue": null
      },
      {
        "variableRef": "VA10",
        "state": "UNKNOWN",
        "semanticValue": null
      },
      {
        "variableRef": "VA11",
        "state": "UNKNOWN",
        "semanticValue": null
      }
    ],
    "contradictionVariableRefs": [],
    "noConfirmedFindings": true
  }
}
