{
  "fixtureId": "CM-05-FX-NO-OBSERVATIONS",
  "capabilityId": "CM-05",
  "packId": "cm-05",
  "packVersion": "1.0.0",
  "kind": "ARCHITECTURE_RUNTIME",
  "knowledgeVersionId": "fixture-kv-cm-05-1.0.0",
  "description": "Sin observaciones: ninguna variable se cierra, no hay hallazgos; ausencia de brecha ≠ fortaleza.",
  "observations": [],
  "expected": {
    "outcome": "PASS",
    "contradictionVariableRefs": [],
    "findingCandidateRefs": [],
    "noConfirmedFindings": true
  }
}
