{
  "fixtureId": "PC-02-FX-NO-OBSERVATIONS",
  "capabilityId": "PC-02",
  "packId": "pc-02",
  "packVersion": "1.0.0",
  "kind": "ARCHITECTURE_RUNTIME",
  "knowledgeVersionId": "fixture-kv-pc-02-1.0.0",
  "description": "Sin observaciones: ninguna variable se cierra, no hay hallazgos; ausencia de brecha ≠ fortaleza.",
  "observations": [],
  "expected": {
    "outcome": "PASS",
    "contradictionVariableRefs": [],
    "findingCandidateRefs": [],
    "noConfirmedFindings": true
  }
}
