{
  "fixtureId": "DT-06-FX-NO-OBSERVATIONS",
  "capabilityId": "DT-06",
  "packId": "dt-06",
  "packVersion": "1.0.0",
  "kind": "ARCHITECTURE_RUNTIME",
  "knowledgeVersionId": "fixture-kv-dt-06-1.0.0",
  "description": "Sin observaciones: ninguna variable se cierra, no hay hallazgos; ausencia de brecha ≠ fortaleza.",
  "observations": [],
  "expected": {
    "outcome": "PASS",
    "contradictionVariableRefs": [],
    "findingCandidateRefs": [],
    "noConfirmedFindings": true
  }
}
