{
  "fixtureId": "EC-02-FX-NO-OBSERVATIONS",
  "capabilityId": "EC-02",
  "packId": "ec-02",
  "packVersion": "1.0.0",
  "kind": "ARCHITECTURE_RUNTIME",
  "knowledgeVersionId": "fixture-kv-ec-02-1.0.0",
  "description": "Sin observaciones: ninguna variable se cierra, no hay hallazgos; ausencia de brecha ≠ fortaleza.",
  "observations": [],
  "expected": {
    "outcome": "PASS",
    "contradictionVariableRefs": [],
    "findingCandidateRefs": [],
    "noConfirmedFindings": true
  }
}
