{
  "fixtureId": "OP02-FX-P1-01-UNKNOWN",
  "capabilityId": "OP-02",
  "packId": "op-02",
  "packVersion": "1.0.0",
  "kind": "SOURCE_DERIVED",
  "description": "UNKNOWN registrado explícitamente en P1-OP02-01 · Ejecución habitual. UNKNOWN es dato capturado, no respuesta negativa.",
  "sourceReference": "OP-02_Completo · OP02-K4-v1.0 · K4-VALIDATED · CLOSED",
  "knowledgeVersionId": "fixture-kv-op02-1.0.0",
  "observations": [
    {
      "id": "u1",
      "variableRef": "VA01",
      "acquisitionRef": "P1-OP02-01",
      "knowledgeState": "UNKNOWN",
      "semanticValue": null,
      "sourceResponseId": "resp-u1",
      "respondentId": "respondent-1",
      "evidenceIds": [],
      "recordedAt": "2026-01-01T00:00:00.000Z"
    }
  ],
  "expected": {
    "outcome": "PASS",
    "variableStates": [
      {
        "variableRef": "VA01",
        "state": "UNKNOWN",
        "semanticValue": null
      }
    ],
    "contradictionVariableRefs": [],
    "noConfirmedFindings": true,
    "note": "UNKNOWN se preserva; no se convierte en hallazgo adverso.",
    "findingCandidateRefs": [],
    "needsReview": true,
    "findingsAwaitingResolution": [
      {
        "findingRef": "OP02-HF01",
        "status": "AWAITING_INFORMATION"
      }
    ]
  }
}
